[
  {"schema_version":"2.0.0","record_type":"canonical_document","document_id":"doc-shelter-r4-en","revision":2,"document_digest":"sha256:b80a65692f7ea774fd5c41cbc7a633128cb9115d6ff3837c3c1dc272a3f74e2d","event_id":"flood-response-region-4","deployment_ids":["site-r4-north"],"scope":{"geographies":["region-4/zone-north"],"languages":["en"],"audiences":["public"]},"canonical_text":"Zone North shelter is open at 125 Oak Street.","structured_facts":[{"fact_id":"shelter-r4-status","value":{"status":"open","address":"125 Oak Street"},"citations":[{"source_id":"source-shelter-r4","evidence_digest":"sha256:66a839afee3abe5a75c084e66fb226226e8f77c0760c8e8644591361bd74e191","location":"line:1"}]}],"source_citations":[{"source_id":"source-shelter-r4","evidence_digest":"sha256:66a839afee3abe5a75c084e66fb226226e8f77c0760c8e8644591361bd74e191","location":"line:1"}],"transformations":[{"tool":"synthetic-drill-normalizer","version":"1.0.0","operation":"canonicalize-en"}],"validity":{"valid_from":"2026-10-06T16:00:00Z","valid_until":"2026-10-07T00:00:00Z","review_due_at":"2026-10-06T20:00:00Z","stale_action":"block"},"authority_rank":100,"conflict":{"state":"none","explanation":"","supersedes":[]},"safety_class":"critical","permitted_delivery_channels":["sms","lora"],"review_attestation_ids":["review-shelter-domain","review-shelter-local"],"approval_state":"approved"},
  {"schema_version":"2.0.0","record_type":"canonical_document","document_id":"doc-shelter-r4-es","revision":2,"document_digest":"sha256:8c83bdf738901740050d931013a2c3376a002f662bb3a5595776d10a20154e49","event_id":"flood-response-region-4","deployment_ids":["site-r4-north"],"scope":{"geographies":["region-4/zone-north"],"languages":["es"],"audiences":["public"]},"canonical_text":"El refugio de Zone North está abierto en 125 Oak Street.","structured_facts":[{"fact_id":"shelter-r4-status","value":{"status":"abierto","address":"125 Oak Street"},"citations":[{"source_id":"source-shelter-r4","evidence_digest":"sha256:66a839afee3abe5a75c084e66fb226226e8f77c0760c8e8644591361bd74e191","location":"line:1"}]}],"source_citations":[{"source_id":"source-shelter-r4","evidence_digest":"sha256:66a839afee3abe5a75c084e66fb226226e8f77c0760c8e8644591361bd74e191","location":"line:1"}],"transformations":[{"tool":"synthetic-drill-translator","version":"1.0.0","operation":"approved-es-translation"}],"validity":{"valid_from":"2026-10-06T16:00:00Z","valid_until":"2026-10-07T00:00:00Z","review_due_at":"2026-10-06T20:00:00Z","stale_action":"block"},"authority_rank":100,"conflict":{"state":"none","explanation":"","supersedes":[]},"safety_class":"critical","permitted_delivery_channels":["sms","lora"],"review_attestation_ids":["review-shelter-domain","review-shelter-es-local"],"approval_state":"approved"},
  {"schema_version":"2.0.0","record_type":"canonical_document","document_id":"doc-water-r4-es","revision":1,"document_digest":"sha256:9bc73bc2eccd51bf69f48a3a059d1d70c8a33d8cf6c7bb053facf3abdd67b58d","event_id":"flood-response-region-4","deployment_ids":["site-r4-north"],"scope":{"geographies":["region-4/zone-north"],"languages":["es"],"audiences":["public"]},"canonical_text":"Hierva el agua de Zone North durante un minuto antes de beberla.","structured_facts":[{"fact_id":"water-r4-boil","value":{"action":"boil","duration_minutes":1},"citations":[{"source_id":"source-water-r4","evidence_digest":"sha256:72ed2c9213e37525417325ebde3aa13dd4bed006f41fcd35b7da7aeb0207bb7e","location":"line:1"}]}],"source_citations":[{"source_id":"source-water-r4","evidence_digest":"sha256:72ed2c9213e37525417325ebde3aa13dd4bed006f41fcd35b7da7aeb0207bb7e","location":"line:1"}],"transformations":[{"tool":"synthetic-drill-translator","version":"1.0.0","operation":"approved-es-translation"}],"validity":{"valid_from":"2026-10-06T16:10:00Z","valid_until":"2026-10-07T00:00:00Z","review_due_at":"2026-10-06T20:00:00Z","stale_action":"block"},"authority_rank":100,"conflict":{"state":"none","explanation":"","supersedes":[]},"safety_class":"critical","permitted_delivery_channels":["sms","lora"],"review_attestation_ids":["review-water-domain","review-water-es-local"],"approval_state":"approved"},
  {"schema_version":"2.0.0","record_type":"canonical_document","document_id":"doc-evacuation-r4-current","revision":2,"document_digest":"sha256:0475990cdaec91a14eca7d18e41b226974a11b97431a62877ab8e01377caebff","event_id":"flood-response-region-4","deployment_ids":["site-r4-north"],"scope":{"geographies":["region-4/zone-north"],"languages":["en"],"audiences":["public"]},"canonical_text":"East Bridge is closed. Evacuate Zone North via West Road.","structured_facts":[{"fact_id":"evacuation-r4-current","value":{"closed_route":"East Bridge","route":"West Road"},"citations":[{"source_id":"source-evacuation-correction","evidence_digest":"sha256:a42cded32b2404fd7da8ae255c365d1ad653797c1a3563e2aad8bc830611a207","location":"line:1"}]}],"source_citations":[{"source_id":"source-evacuation-correction","evidence_digest":"sha256:a42cded32b2404fd7da8ae255c365d1ad653797c1a3563e2aad8bc830611a207","location":"line:1"}],"transformations":[{"tool":"synthetic-drill-normalizer","version":"1.0.0","operation":"apply-correction"}],"validity":{"valid_from":"2026-10-06T17:00:00Z","valid_until":"2026-10-07T00:00:00Z","review_due_at":"2026-10-06T20:00:00Z","stale_action":"block"},"authority_rank":100,"conflict":{"state":"resolved","explanation":"Correction closes East Bridge and replaces the expired route.","supersedes":[{"document_id":"doc-evacuation-r4-old","revision":1,"digest":"sha256:a01908ee4f1a83969ae9a445c7376e7a0d2fe5a13e4fb60363bf0dbb72b2bd08"}]},"safety_class":"critical","permitted_delivery_channels":["sms","lora"],"review_attestation_ids":["review-evacuation-domain","review-evacuation-local"],"approval_state":"approved"},
  {"schema_version":"2.0.0","record_type":"canonical_document","document_id":"doc-evacuation-r4-old","revision":1,"document_digest":"sha256:a01908ee4f1a83969ae9a445c7376e7a0d2fe5a13e4fb60363bf0dbb72b2bd08","event_id":"flood-response-region-4","deployment_ids":["site-r4-north"],"scope":{"geographies":["region-4/zone-north"],"languages":["en"],"audiences":["public"]},"canonical_text":"Use East Bridge to evacuate Zone North.","structured_facts":[{"fact_id":"evacuation-r4-superseded","value":{"route":"East Bridge"},"citations":[{"source_id":"source-evacuation-old","evidence_digest":"sha256:e14031f9729d7df792c1253fd13f0b101f2d187e816b26aec464528e5aacdf86","location":"line:1"}]}],"source_citations":[{"source_id":"source-evacuation-old","evidence_digest":"sha256:e14031f9729d7df792c1253fd13f0b101f2d187e816b26aec464528e5aacdf86","location":"line:1"}],"transformations":[{"tool":"synthetic-drill-normalizer","version":"1.0.0","operation":"canonicalize-en"}],"validity":{"valid_from":"2026-10-06T12:00:00Z","valid_until":"2026-10-06T17:00:00Z","review_due_at":"2026-10-06T17:00:00Z","stale_action":"block"},"authority_rank":100,"conflict":{"state":"resolved","explanation":"Superseded by the West Road correction.","supersedes":[]},"safety_class":"critical","permitted_delivery_channels":["sms","lora"],"review_attestation_ids":["review-evacuation-old"],"approval_state":"approved"},
  {"schema_version":"2.0.0","record_type":"canonical_document","document_id":"doc-shelter-r5-distractor","revision":1,"document_digest":"sha256:ab9119987859382f1d3a37300307ba18208b224f57785320040aea8fdc310b7d","event_id":"flood-response-region-4","deployment_ids":["site-r4-north"],"scope":{"geographies":["region-5/zone-north"],"languages":["en"],"audiences":["public"]},"canonical_text":"Region 5 Zone North shelter is at 9 Pine Avenue.","structured_facts":[{"fact_id":"shelter-r5-distractor","value":{"address":"9 Pine Avenue"},"citations":[{"source_id":"source-shelter-r5","evidence_digest":"sha256:5eb61d25ddec0b99962e228d2d2e1618957f62cefd755da88ecb56122c0263a5","location":"line:1"}]}],"source_citations":[{"source_id":"source-shelter-r5","evidence_digest":"sha256:5eb61d25ddec0b99962e228d2d2e1618957f62cefd755da88ecb56122c0263a5","location":"line:1"}],"transformations":[{"tool":"synthetic-drill-normalizer","version":"1.0.0","operation":"canonicalize-en"}],"validity":{"valid_from":"2026-10-06T16:05:00Z","valid_until":"2026-10-07T00:00:00Z","review_due_at":"2026-10-06T20:00:00Z","stale_action":"block"},"authority_rank":100,"conflict":{"state":"none","explanation":"","supersedes":[]},"safety_class":"critical","permitted_delivery_channels":["sms","lora"],"review_attestation_ids":["review-neighbor-boundary"],"approval_state":"approved"}
]
